[
  {
    "camera_presence": "unknown",
    "id": "atm-osm-node-10302282791",
    "latitude": 59.3249705,
    "longitude": 18.0693319,
    "name": null,
    "operator": null,
    "source_ids": [
      "openstreetmap-stockholm-atms"
    ],
    "source_url": "https://www.openstreetmap.org/node/10302282791"
  },
  {
    "camera_presence": "unknown",
    "id": "atm-osm-node-10542949328",
    "latitude": 59.3391278,
    "longitude": 18.0563128,
    "name": "Euronet",
    "operator": "Euronet",
    "source_ids": [
      "openstreetmap-stockholm-atms"
    ],
    "source_url": "https://www.openstreetmap.org/node/10542949328"
  },
  {
    "camera_presence": "unknown",
    "id": "atm-osm-node-1090537316",
    "latitude": 59.3365356,
    "longitude": 18.0785816,
    "name": "SEB",
    "operator": "SEB",
    "source_ids": [
      "openstreetmap-stockholm-atms"
    ],
    "source_url": "https://www.openstreetmap.org/node/1090537316"
  },
  {
    "camera_presence": "unknown",
    "id": "atm-osm-node-10908665992",
    "latitude": 59.3397004,
    "longitude": 18.0360971,
    "name": null,
    "operator": null,
    "source_ids": [
      "openstreetmap-stockholm-atms"
    ],
    "source_url": "https://www.openstreetmap.org/node/10908665992"
  },
  {
    "camera_presence": "unknown",
    "id": "atm-osm-node-11118221391",
    "latitude": 59.4591615,
    "longitude": 18.1390853,
    "name": null,
    "operator": null,
    "source_ids": [
      "openstreetmap-stockholm-atms"
    ],
    "source_url": "https://www.openstreetmap.org/node/11118221391"
  },
  {
    "camera_presence": "unknown",
    "id": "atm-osm-node-11208627678",
    "latitude": 59.2623443,
    "longitude": 18.0139375,
    "name": null,
    "operator": "ICA Banken",
    "source_ids": [
      "openstreetmap-stockholm-atms"
    ],
    "source_url": "https://www.openstreetmap.org/node/11208627678"
  },
  {
    "camera_presence": "unknown",
    "id": "atm-osm-node-11208658497",
    "latitude": 59.2622048,
    "longitude": 18.0149046,
    "name": null,
    "operator": "Bankomat AB",
    "source_ids": [
      "openstreetmap-stockholm-atms"
    ],
    "source_url": "https://www.openstreetmap.org/node/11208658497"
  },
  {
    "camera_presence": "unknown",
    "id": "atm-osm-node-1126903215",
    "latitude": 59.3184925,
    "longitude": 18.0603948,
    "name": "Handelsbanken",
    "operator": "Handelsbanken",
    "source_ids": [
      "openstreetmap-stockholm-atms"
    ],
    "source_url": "https://www.openstreetmap.org/node/1126903215"
  },
  {
    "camera_presence": "unknown",
    "id": "atm-osm-node-11563720236",
    "latitude": 59.3555383,
    "longitude": 17.9450181,
    "name": null,
    "operator": "Forex Bank",
    "source_ids": [
      "openstreetmap-stockholm-atms"
    ],
    "source_url": "https://www.openstreetmap.org/node/11563720236"
  },
  {
    "camera_presence": "unknown",
    "id": "atm-osm-node-1161921154",
    "latitude": 59.3103674,
    "longitude": 18.021813,
    "name": "Nordea",
    "operator": "Nordea",
    "source_ids": [
      "openstreetmap-stockholm-atms"
    ],
    "source_url": "https://www.openstreetmap.org/node/1161921154"
  },
  {
    "camera_presence": "unknown",
    "id": "atm-osm-node-1193166668",
    "latitude": 59.2426113,
    "longitude": 18.0925215,
    "name": null,
    "operator": null,
    "source_ids": [
      "openstreetmap-stockholm-atms"
    ],
    "source_url": "https://www.openstreetmap.org/node/1193166668"
  },
  {
    "camera_presence": "unknown",
    "id": "atm-osm-node-11993275930",
    "latitude": 59.4019278,
    "longitude": 17.9460596,
    "name": null,
    "operator": null,
    "source_ids": [
      "openstreetmap-stockholm-atms"
    ],
    "source_url": "https://www.openstreetmap.org/node/11993275930"
  },
  {
    "camera_presence": "unknown",
    "id": "atm-osm-node-1200263327",
    "latitude": 59.4768597,
    "longitude": 17.9123447,
    "name": null,
    "operator": "Bankomat",
    "source_ids": [
      "openstreetmap-stockholm-atms"
    ],
    "source_url": "https://www.openstreetmap.org/node/1200263327"
  },
  {
    "camera_presence": "unknown",
    "id": "atm-osm-node-12006178270",
    "latitude": 59.4100973,
    "longitude": 17.9258631,
    "name": "Bankomat",
    "operator": null,
    "source_ids": [
      "openstreetmap-stockholm-atms"
    ],
    "source_url": "https://www.openstreetmap.org/node/12006178270"
  },
  {
    "camera_presence": "unknown",
    "id": "atm-osm-node-1202971230",
    "latitude": 59.3643023,
    "longitude": 17.9951898,
    "name": null,
    "operator": "Bankomat AB",
    "source_ids": [
      "openstreetmap-stockholm-atms"
    ],
    "source_url": "https://www.openstreetmap.org/node/1202971230"
  },
  {
    "camera_presence": "unknown",
    "id": "atm-osm-node-1204403063",
    "latitude": 59.3486543,
    "longitude": 18.101006,
    "name": "Handelsbanken",
    "operator": "Handelsbanken",
    "source_ids": [
      "openstreetmap-stockholm-atms"
    ],
    "source_url": "https://www.openstreetmap.org/node/1204403063"
  },
  {
    "camera_presence": "unknown",
    "id": "atm-osm-node-12064451623",
    "latitude": 59.2479859,
    "longitude": 17.8606354,
    "name": null,
    "operator": "Bankomat",
    "source_ids": [
      "openstreetmap-stockholm-atms"
    ],
    "source_url": "https://www.openstreetmap.org/node/12064451623"
  },
  {
    "camera_presence": "unknown",
    "id": "atm-osm-node-12070612427",
    "latitude": 59.3490475,
    "longitude": 18.1456549,
    "name": null,
    "operator": null,
    "source_ids": [
      "openstreetmap-stockholm-atms"
    ],
    "source_url": "https://www.openstreetmap.org/node/12070612427"
  },
  {
    "camera_presence": "unknown",
    "id": "atm-osm-node-12095932104",
    "latitude": 59.4115857,
    "longitude": 17.8021791,
    "name": "ICA Kvantum Viksjö",
    "operator": "ICA Kvantum",
    "source_ids": [
      "openstreetmap-stockholm-atms"
    ],
    "source_url": "https://www.openstreetmap.org/node/12095932104"
  },
  {
    "camera_presence": "unknown",
    "id": "atm-osm-node-12110517750",
    "latitude": 59.365553,
    "longitude": 18.1336245,
    "name": null,
    "operator": "Bankomat",
    "source_ids": [
      "openstreetmap-stockholm-atms"
    ],
    "source_url": "https://www.openstreetmap.org/node/12110517750"
  },
  {
    "camera_presence": "unknown",
    "id": "atm-osm-node-1213866623",
    "latitude": 59.2429246,
    "longitude": 18.0893273,
    "name": "SEB",
    "operator": "SEB",
    "source_ids": [
      "openstreetmap-stockholm-atms"
    ],
    "source_url": "https://www.openstreetmap.org/node/1213866623"
  },
  {
    "camera_presence": "unknown",
    "id": "atm-osm-node-1233864683",
    "latitude": 59.2418004,
    "longitude": 18.0904104,
    "name": "Nordea",
    "operator": "Nordea",
    "source_ids": [
      "openstreetmap-stockholm-atms"
    ],
    "source_url": "https://www.openstreetmap.org/node/1233864683"
  },
  {
    "camera_presence": "unknown",
    "id": "atm-osm-node-1251653371",
    "latitude": 59.4454879,
    "longitude": 17.9660349,
    "name": null,
    "operator": null,
    "source_ids": [
      "openstreetmap-stockholm-atms"
    ],
    "source_url": "https://www.openstreetmap.org/node/1251653371"
  },
  {
    "camera_presence": "unknown",
    "id": "atm-osm-node-12650328275",
    "latitude": 59.4140276,
    "longitude": 17.8645345,
    "name": null,
    "operator": "Bankomat",
    "source_ids": [
      "openstreetmap-stockholm-atms"
    ],
    "source_url": "https://www.openstreetmap.org/node/12650328275"
  },
  {
    "camera_presence": "unknown",
    "id": "atm-osm-node-12864782439",
    "latitude": 59.3340323,
    "longitude": 18.0325423,
    "name": null,
    "operator": "Ta ut",
    "source_ids": [
      "openstreetmap-stockholm-atms"
    ],
    "source_url": "https://www.openstreetmap.org/node/12864782439"
  },
  {
    "camera_presence": "unknown",
    "id": "atm-osm-node-13196209368",
    "latitude": 59.4114871,
    "longitude": 17.8030384,
    "name": null,
    "operator": "Bankomat",
    "source_ids": [
      "openstreetmap-stockholm-atms"
    ],
    "source_url": "https://www.openstreetmap.org/node/13196209368"
  },
  {
    "camera_presence": "unknown",
    "id": "atm-osm-node-1327385727",
    "latitude": 59.4307153,
    "longitude": 18.0958502,
    "name": null,
    "operator": "SEB",
    "source_ids": [
      "openstreetmap-stockholm-atms"
    ],
    "source_url": "https://www.openstreetmap.org/node/1327385727"
  },
  {
    "camera_presence": "unknown",
    "id": "atm-osm-node-13343040184",
    "latitude": 59.3684527,
    "longitude": 17.9797772,
    "name": null,
    "operator": "Kontanten",
    "source_ids": [
      "openstreetmap-stockholm-atms"
    ],
    "source_url": "https://www.openstreetmap.org/node/13343040184"
  },
  {
    "camera_presence": "unknown",
    "id": "atm-osm-node-13344064463",
    "latitude": 59.3128639,
    "longitude": 18.0715152,
    "name": "Swedbank",
    "operator": "Swedbank",
    "source_ids": [
      "openstreetmap-stockholm-atms"
    ],
    "source_url": "https://www.openstreetmap.org/node/13344064463"
  },
  {
    "camera_presence": "unknown",
    "id": "atm-osm-node-1334429728",
    "latitude": 59.2362414,
    "longitude": 17.9806973,
    "name": null,
    "operator": "Kontanten",
    "source_ids": [
      "openstreetmap-stockholm-atms"
    ],
    "source_url": "https://www.openstreetmap.org/node/1334429728"
  },
  {
    "camera_presence": "unknown",
    "id": "atm-osm-node-13404341308",
    "latitude": 59.3647299,
    "longitude": 17.9743612,
    "name": null,
    "operator": null,
    "source_ids": [
      "openstreetmap-stockholm-atms"
    ],
    "source_url": "https://www.openstreetmap.org/node/13404341308"
  },
  {
    "camera_presence": "unknown",
    "id": "atm-osm-node-1348515191",
    "latitude": 59.3107781,
    "longitude": 18.0753237,
    "name": null,
    "operator": "Kontanten",
    "source_ids": [
      "openstreetmap-stockholm-atms"
    ],